{
  "brief_schema_version": "1.5",
  "doc_language": "Indonesia",
  "domain": {
    "entities": [
      {
        "name": "Challenge"
      }
    ]
  },
  "language": {
    "archetype": "playful-vivid",
    "brands": [
      {
        "id": "default"
      }
    ],
    "mode": "archetype",
    "themes": [
      {
        "name": "Light"
      },
      {
        "name": "Dark"
      }
    ]
  },
  "namespace": "GRK",
  "product_name": "Gerak",
  "report_language": "Indonesia",
  "run_mode": "greenfield",
  "surfaces": [
    {
      "connectivity": "online",
      "default_theme": "Light",
      "density_modes": [
        "comfortable"
      ],
      "device": "ponsel",
      "input_modality": [
        "touch",
        "in-motion"
      ],
      "name": "family-app",
      "os_runtime": "iOS",
      "surface_type": "consumer"
    }
  ],
  "targets": {
    "primary_web_reference": "react",
    "production_targets": [
      "flutter"
    ]
  },
  "ui_locales": [
    "id-ID"
  ]
}
