{
  "brief_schema_version": "1.5",
  "doc_language": "Indonesia",
  "domain": {
    "critical_events": [
      {
        "name": "Core link down",
        "severity": "financial"
      }
    ],
    "entities": [
      {
        "name": "Incident"
      }
    ]
  },
  "language": {
    "archetype": "dense-console",
    "brands": [
      {
        "id": "default",
        "interaction_hex": "#2f81f7"
      }
    ],
    "mode": "archetype",
    "themes": [
      {
        "name": "Dark"
      },
      {
        "name": "Light"
      }
    ]
  },
  "namespace": "PTU",
  "product_name": "Pantau",
  "report_language": "Indonesia",
  "run_mode": "greenfield",
  "surfaces": [
    {
      "connectivity": "online",
      "default_theme": "Dark",
      "density_modes": [
        "comfortable",
        "compact"
      ],
      "device": "desktop",
      "input_modality": [
        "pointer",
        "keyboard"
      ],
      "name": "noc-console",
      "os_runtime": "web",
      "surface_type": "operational"
    },
    {
      "connectivity": "online",
      "default_theme": "Dark",
      "density_modes": [
        "comfortable"
      ],
      "device": "ponsel",
      "input_modality": [
        "touch"
      ],
      "name": "oncall-app",
      "os_runtime": "Android",
      "surface_type": "operational"
    }
  ],
  "targets": {
    "primary_web_reference": "react",
    "production_targets": [
      "flutter"
    ]
  },
  "ui_locales": [
    "id-ID"
  ]
}
