{
  "brief_schema_version": "1.5",
  "doc_language": "Indonesia",
  "domain": {
    "entities": [
      {
        "name": "Order"
      },
      {
        "name": "Payment"
      }
    ]
  },
  "hygiene": {
    "leak_terms": [
      "golf",
      "caddie",
      "handicap",
      "The Green Clubs",
      "TGC"
    ]
  },
  "language": {
    "archetype": "brand-led-tonal",
    "brands": [
      {
        "id": "default",
        "interaction_hex": "#4F46E5"
      },
      {
        "id": "kopi-senja",
        "interaction_hex": "#C2410C"
      },
      {
        "id": "kopi-pagi",
        "interaction_hex": "#0F766E"
      }
    ],
    "mode": "archetype",
    "themes": [
      {
        "name": "Light"
      },
      {
        "name": "Dark"
      }
    ]
  },
  "namespace": "SDH",
  "product_name": "Seduh",
  "report_language": "Indonesia",
  "run_mode": "greenfield",
  "surfaces": [
    {
      "connectivity": "online",
      "default_theme": "Light",
      "density_modes": [
        "comfortable"
      ],
      "device": "ponsel",
      "input_modality": [
        "touch"
      ],
      "name": "customer-app",
      "os_runtime": "iOS",
      "surface_type": "consumer"
    },
    {
      "connectivity": "online",
      "default_theme": "Light",
      "density_modes": [
        "comfortable"
      ],
      "device": "desktop",
      "input_modality": [
        "pointer",
        "keyboard"
      ],
      "name": "outlet-web",
      "os_runtime": "web",
      "surface_type": "operational"
    }
  ],
  "targets": {
    "primary_web_reference": "react",
    "production_targets": [
      "flutter"
    ]
  },
  "ui_locales": [
    "id-ID"
  ],
  "version_label": "SDH-01"
}
