{
  "brief_schema_version": "1.5",
  "doc_language": "Indonesia",
  "domain": {
    "entities": [
      {
        "name": "Loan"
      }
    ]
  },
  "language": {
    "brands": [
      {
        "id": "default"
      }
    ],
    "mode": "derive",
    "personality": {
      "density": 1,
      "expressiveness": 4,
      "formality": 2,
      "risk_criticality": 1,
      "warmth": 5
    },
    "themes": [
      {
        "name": "Light"
      },
      {
        "name": "Dark"
      }
    ]
  },
  "namespace": "RB",
  "product_name": "Ruang Baca",
  "report_language": "Indonesia",
  "run_mode": "greenfield",
  "surfaces": [
    {
      "connectivity": "online",
      "default_theme": "Light",
      "density_modes": [
        "comfortable"
      ],
      "device": "ponsel",
      "input_modality": [
        "touch"
      ],
      "name": "member-app",
      "os_runtime": "iOS",
      "surface_type": "consumer"
    }
  ],
  "targets": {
    "primary_web_reference": "react",
    "production_targets": [
      "flutter"
    ]
  },
  "ui_locales": [
    "id-ID"
  ]
}
