{
  "brief_schema_version": "1.5",
  "doc_language": "Indonesia",
  "domain": {
    "entities": [
      {
        "name": "Subscription"
      }
    ]
  },
  "language": {
    "archetype": "immersive-glass",
    "brands": [
      {
        "id": "default",
        "interaction_hex": "#22D3EE"
      }
    ],
    "mode": "archetype",
    "themes": [
      {
        "name": "Dark"
      },
      {
        "name": "Light"
      }
    ]
  },
  "namespace": "LYR",
  "product_name": "Layar",
  "report_language": "Indonesia",
  "run_mode": "greenfield",
  "surfaces": [
    {
      "connectivity": "online",
      "default_theme": "Dark",
      "density_modes": [
        "comfortable"
      ],
      "device": "ponsel",
      "input_modality": [
        "touch"
      ],
      "name": "viewer-app",
      "os_runtime": "iOS",
      "surface_type": "content"
    },
    {
      "connectivity": "online",
      "default_theme": "Dark",
      "density_modes": [
        "comfortable"
      ],
      "device": "desktop",
      "input_modality": [
        "pointer",
        "keyboard"
      ],
      "name": "viewer-web",
      "os_runtime": "web",
      "surface_type": "content"
    }
  ],
  "targets": {
    "primary_web_reference": "react",
    "production_targets": [
      "flutter"
    ]
  },
  "ui_locales": [
    "id-ID"
  ]
}
