{
  "brief_schema_version": "1.5",
  "doc_language": "Indonesia",
  "domain": {
    "critical_events": [],
    "entities": [
      {
        "name": "PickList",
        "states": [
          "draft",
          "assigned",
          "picking",
          "picked",
          "cancelled",
          "failed"
        ]
      }
    ]
  },
  "domain_summary": "Sistem gudang untuk distributor sembako.",
  "hygiene": {
    "leak_terms": [
      "golf",
      "caddie",
      "tee time",
      "handicap",
      "Rainbow Hills",
      "The Green Clubs",
      "TGC"
    ]
  },
  "language": {
    "archetype": "ink-graphite",
    "brands": [
      {
        "id": "default"
      }
    ],
    "mode": "archetype",
    "neutral_temperature": "cool",
    "themes": [
      {
        "name": "Light",
        "purpose": "kantor"
      },
      {
        "name": "High-contrast",
        "purpose": "gudang dengan cahaya tidak merata"
      }
    ]
  },
  "namespace": "LBG",
  "product_name": "Lumbung",
  "report_language": "Indonesia",
  "run_mode": "greenfield",
  "surfaces": [
    {
      "connectivity": "online",
      "default_theme": "Light",
      "density_modes": [
        "comfortable",
        "compact"
      ],
      "device": "desktop",
      "input_modality": [
        "pointer",
        "keyboard"
      ],
      "name": "web-admin",
      "os_runtime": "web",
      "surface_type": "operational"
    },
    {
      "connectivity": "offline-first",
      "default_theme": "High-contrast",
      "density_modes": [
        "comfortable"
      ],
      "device": "ponsel",
      "input_modality": [
        "touch",
        "scanner",
        "glove"
      ],
      "name": "handheld",
      "os_runtime": "Android",
      "surface_type": "operational"
    }
  ],
  "targets": {
    "primary_web_reference": "react",
    "production_targets": [
      "flutter"
    ]
  },
  "ui_locales": [
    "id-ID"
  ],
  "version_label": "LBG-01"
}
