{
  "brief_schema_version": "1.5",
  "doc_language": "Indonesia",
  "domain": {
    "entities": [
      {
        "name": "Reservation"
      }
    ]
  },
  "language": {
    "archetype": "quiet-luxury",
    "brands": [
      {
        "id": "default",
        "interaction_hex": "#B08D57"
      }
    ],
    "mode": "archetype",
    "themes": [
      {
        "name": "Light"
      },
      {
        "name": "Dark"
      }
    ]
  },
  "namespace": "SRB",
  "product_name": "Serambi",
  "report_language": "Indonesia",
  "run_mode": "greenfield",
  "surfaces": [
    {
      "connectivity": "online",
      "default_theme": "Light",
      "density_modes": [
        "comfortable"
      ],
      "device": "ponsel",
      "input_modality": [
        "touch"
      ],
      "name": "member-app",
      "os_runtime": "iOS",
      "surface_type": "consumer"
    }
  ],
  "targets": {
    "primary_web_reference": "react",
    "production_targets": [
      "flutter"
    ]
  },
  "ui_locales": [
    "id-ID",
    "en-US",
    "ar-SA"
  ]
}
